{"$schema":"https://json-schema.org/draft/2020-12/schema","type":"object","additionalProperties":false,"required":["schema_version","project_id","display_name","source_roots","input_root","workspace_root","output_root","asset_profiles"],"properties":{"schema_version":{"const":"1.0"},"project_id":{"type":"string","pattern":"^[a-z0-9._-]+$"},"display_name":{"type":"string","minLength":1},"source_roots":{"type":"array","minItems":1,"items":{"type":"object","additionalProperties":false,"required":["id","path","access"],"properties":{"id":{"type":"string"},"path":{"type":"string"},"access":{"const":"read_only"}}}},"input_root":{"type":"string"},"workspace_root":{"type":"string"},"output_root":{"type":"string"},"asset_profiles":{"type":"array","items":{"type":"string"},"uniqueItems":true},"created_at":{"type":"string"},"updated_at":{"type":"string"}}}
